{
  "snapshotId": "snapshot-001",
  "ruleSetVersion": "RULE-SET-1.0.0",
  "profileVersion": "1.0",
  "registerVersion": "RULE-REGISTER-0.1.0",
  "sourceUrl": "https://schedule.local/rules",
  "sourceLocator": "RULE-EDU-001",
  "effectiveFrom": "2025-04-22",
  "effectiveTo": null,
  "scope": { "schoolLevel": "THCS", "schoolId": "school-001" },
  "approvalState": "APPROVED",
  "approvedBy": "approver-001",
  "approvedAt": "2026-08-25T00:00:00.000Z",
  "rules": [
    {
      "code": "RULE-EDU-001",
      "kind": "HARD",
      "weight": null,
      "sourceUrl": "https://schedule.local/rules",
      "sourceLocator": "RULE-EDU-001",
      "effectiveFrom": "2025-04-22",
      "effectiveTo": null,
      "scope": { "schoolLevel": "THCS" },
      "approvalState": "APPROVED",
      "approvedBy": "approver-001",
      "approvedAt": "2026-08-25T00:00:00.000Z",
      "parameters": { "durationMinutes": 45 }
    },
    {
      "code": "RULE-SCHOOL-002",
      "kind": "SOFT",
      "weight": 2,
      "sourceUrl": "https://schedule.local/rules",
      "effectiveFrom": "2025-04-22",
      "effectiveTo": "2025-12-31",
      "scope": { "schoolId": "school-001" },
      "approvalState": "APPROVED",
      "approvedBy": "approver-001",
      "approvedAt": "2026-08-25T00:00:00.000Z",
      "parameters": { "avoidLastPeriod": true }
    }
  ],
  "snapshotHash": "0000000000000000000000000000000000000000000000000000000000000000",
  "capturedAt": "2026-08-25T00:00:00.000Z",
  "capturedBy": "scheduler-001"
}
